{
  "schemaVersion":1,"profileId":"vibecoding-v1","locale":"ru-RU","languageName":"Русский","script":"Cyrillic","tier":"primary","delivery":"software-dispatcher","inputMethod":"direct-unicode",
  "actions":{
    "CHECK":{"type":"text","text":"Проверь текущую работу. Найди ошибки, пропуски и несоответствия."},
    "NEXT":{"type":"text","text":"Переходи к следующему логичному шагу."},
    "AGENT_PROMPT":{"type":"text","text":"Подготовь точный промпт для следующего агента с контекстом, задачей, ограничениями и критериями готовности."},
    "FIX":{"type":"text","text":"Исправь найденные проблемы в согласованном объеме и затем перепроверь результат."},
    "PUBLISH":{"type":"text","text":"Подготовь текущий результат к публикации. Не выполняй необратимые действия без отдельного подтверждения."},
    "MERGE":{"type":"text","text":"Подготовь изменение к merge, проверь критерии готовности и запроси отдельное подтверждение перед merge."},
    "CREATE":{"type":"text","text":"Создай запрошенный артефакт или изменение в текущем согласованном объеме."},
    "CONTINUE":{"type":"text","text":"Продолжай текущую работу с последней подтвержденной точки."},
    "REVIEW":{"type":"text","text":"Проведи ревью текущего результата и перечисли найденные проблемы по приоритету."},
    "TEST":{"type":"text","text":"Запусти или проверь релевантные тесты и сообщи фактический результат."},
    "STATUS":{"type":"text","text":"Сообщи краткий текущий статус, что уже сделано, что блокирует и какой следующий шаг."},
    "NEW_LINE":{"type":"dispatcher","command":"NEW_LINE"},
    "REJECT_OR_STOP":{"type":"text","text":"Останови текущий путь и подготовь безопасный откат или альтернативу. Не выполняй необратимые действия."},
    "ACCEPT_OR_APPROVE":{"type":"text","text":"Зафиксируй текущее решение как одобренное в пределах уже согласованного объема."},
    "PUSH_TO_TALK":{"type":"dispatcher","command":"PUSH_TO_TALK"}
  }
}
