{
  "schemaVersion":1,"profileId":"vibecoding-v1","locale":"ko-KR","languageName":"한국어","script":"Hangul","tier":"extended","delivery":"software-dispatcher","inputMethod":"ime-or-direct-unicode",
  "actions":{
    "CHECK":{"type":"text","text":"현재 작업을 확인하고 오류, 누락 및 불일치를 찾아 주세요."},
    "NEXT":{"type":"text","text":"다음 논리적 단계로 진행해 주세요."},
    "AGENT_PROMPT":{"type":"text","text":"다음 에이전트를 위해 컨텍스트, 작업, 제약 조건 및 완료 기준이 포함된 정확한 프롬프트를 준비해 주세요."},
    "FIX":{"type":"text","text":"합의된 범위 내에서 발견된 문제를 수정한 다음 결과를 다시 검증해 주세요."},
    "PUBLISH":{"type":"text","text":"현재 결과를 게시할 수 있도록 준비해 주세요. 별도의 확인 없이 되돌릴 수 없는 작업을 수행하지 마세요."},
    "MERGE":{"type":"text","text":"변경 사항을 병합할 수 있도록 준비하고 준비 기준을 확인한 뒤, 병합 전에 별도의 확인을 요청해 주세요."},
    "CREATE":{"type":"text","text":"현재 합의된 범위 내에서 요청된 산출물 또는 변경 사항을 만들어 주세요."},
    "CONTINUE":{"type":"text","text":"마지막으로 확인된 지점부터 현재 작업을 계속해 주세요."},
    "REVIEW":{"type":"text","text":"현재 결과를 검토하고 발견된 문제를 우선순위 순으로 나열해 주세요."},
    "TEST":{"type":"text","text":"관련 테스트를 실행하거나 확인하고 실제 결과를 보고해 주세요."},
    "STATUS":{"type":"text","text":"현재 상태를 간단히 보고해 주세요. 완료된 작업, 차단 요소 및 다음 단계를 포함해 주세요."},
    "NEW_LINE":{"type":"dispatcher","command":"NEW_LINE"},
    "REJECT_OR_STOP":{"type":"text","text":"현재 경로를 중단하고 안전한 롤백 또는 대안을 준비해 주세요. 되돌릴 수 없는 작업을 수행하지 마세요."},
    "ACCEPT_OR_APPROVE":{"type":"text","text":"이미 합의된 범위 내에서 현재 결정을 승인된 것으로 기록해 주세요."},
    "PUSH_TO_TALK":{"type":"dispatcher","command":"PUSH_TO_TALK"}
  }
}
